,question,answer,source
103101,What is the ruling on entering the toilet with some verses of Quran in one’s wallet? Is it permissible to carry verses of the Quran in one’s wallet that is in one’s pocket and enter the bathroom with them sometimes?,"['Praise be to Allah.It is prohibited to enter the toilet carrying the Mus-haf or part of it except in the case of necessity, such as if there is the fear that it will be lost if it is left outside.\nIt says in Kashshaf al-Qina`, 1/60: It is prohibited to enter the toilet with a Mus-haf except in the case of necessity. It says in al-Insaf: There is no doubt that it is definitely prohibited, and no wise person would have any reservations about that prohibition. I say: Part of the Mus-haf is the same as the entire Mus-haf in this regard. End quote.\nPlease see the answer to question no. 42061.\nWith regard to carrying some verses of the Quran, if what is meant is carrying some printed parts or surahs of the Quran for the purpose of reading them or memorizing them, there is nothing wrong with that. But one should not tear them out of the Mus-haf, because that is showing disrespect to the Quran.\nBut if those verses are carried for the purpose of seeking blessing, warding off the evil eye and the like, this is a matter concerning which the scholars differed, but what is more likely to be the case is that it is not allowed. Please see the answer to question no. 10543.\nAnd Allah knows best.']",https://islamqa.info/en/answers/103101/ruling-on-entering-the-toilet-with-some-verses-of-the-quran-in-ones-wallet
299690,What does Taghabun mean in Islam?,"['Praise be to Allah.The Linguistic Roots of Taghabun in Arabic\nThe Arabic word Taghabun (great loss or deprivation) comes from the word Ghabn, which means loss when buying or selling, or selling someone short.\nImam Al-Fayyumi (may Allah have mercy on him) said: This word is used with regard to buying or selling, and refers to giving someone less than the correct price, and the like. (End quote from Al-Misbah Al-Munir, 42) (Mukhtar As-Sihah, entry on Ghayn ba’ nun, p. 224; Al-Qamus Al-Muhit and Fasl Al-Ghayn, 1/1219)\nAsh-Shinqiti (may Allah have mercy on him) said: Ghabn is the feeling of imperfection; a similar word is Khabn. These words share two out of three letters, according to the rules of language, as they are close in meaning, and the letters that differ are very close, namely Ghayn and Kha’, as the Ghayn comes from further back in the throat, whilst the Kha’ comes from a place closer to the front. Therefore Ghabn refers to that which is hidden, and Khabn refers to that which is more apparent. (End quote from Adwa’ Al-Bayan, 8/201)\nHow Taghabun Relates to the Day of Resurrection\nTherefore, the Day of Resurrection is called Yawm At-Taghabun (the day of great loss or deprivation), because of what will become apparent on that day of the loss of those who followed disbelief and misguidance, for they have sold their hereafter for the sake of worldly gain. So their loss will become apparent and whatever profit they made will perish.\nQuranic References to Taghabun\nAr-Raghib Al-Asfahani (may Allah have mercy on him) said: Ghabn refers to when you undercut your opposite number and undervalue his product in a subtle manner. This word is used in the context of a trade or transaction, and also may be used to describe when one fails to pay attention.\nYawm At-Taghabun (the Day of Deprivation) is the Day of Resurrection, because of the losses that will become very evident in the trade referred to in the verses (interpretation of the meaning):\n{And of the people is he who sells himself, seeking means to the approval of Allah. And Allah is kind to [His] servants.} [Al-Baqarah 2:207]\n{Indeed, Allah has purchased from the believers their lives and their properties [in exchange] for that they will have Paradise. They fight in the cause of Allah, so they kill and are killed. [It is] a true promise [binding] upon Him in the Torah and the Gospel and the Qur’an. And who is truer to his covenant than Allah? So rejoice in your transaction which you have contracted. And it is that which is the great attainment.} [At-Tawbah 9:111]\n{Indeed, those who exchange the covenant of Allah and their [own] oaths for a small price will have no share in the Hereafter, and Allah will not speak to them or look at them on the Day of Resurrection, nor will He purify them; and they will have a painful punishment.} [Al `Imran 3:77]\nThey will realize that they have become losers because of not getting involved in this transaction with Allah, and because of their reaction to all these offers.\nScholarly Interpretations of Taghabun\nOne of the scholars was asked about Yawm At-Taghabun and he said: Things will appear to have different values to what they estimated in this world.\nOne of the commentators on the Quran said: The original meaning of Ghubn is to hide something; Ghabn refers to the place where something is hidden. (End quote from Al-Mufradat fi Gharib Al-Quran, 602)\nAt-Tabari (23/419) narrated with a good chain of narration from `Ali ibn Abu Talhah, that Ibn `Abbas (may Allah be pleased him) said concerning the words “that is the Day of Deprivation [Yawm At-Taghabun]” [At-Taghabun 64:9]: This is one of the names of the Day of Resurrection; here Allah is alerting us to its momentous nature and warning His slaves of it.\nHe also narrated with a good chain of narration from Mujahid that he said concerning the words “that is the Day of Deprivation” [At-Taghabun 64:9]: It is the day when the people of Paradise will have got the best deal, to the exclusion of the people of Hell.\nHe narrated from Qatadah that he said concerning the words “that is the Day of Deprivation” [At-Taghabun 64:9]: That is the Day of Resurrection, which is Yawm At-Taghabun (The Day of Deprivation), the day when the people of Paradise will have got the best deal, to the exclusion of the people of Hell.\nIbn Jarir (may Allah have mercy on him) said concerning the words “that is the Day of Deprivation” [At-Taghabun 64:9]: It is the day when the people of Paradise will have got the best deal, to the exclusion of the people of Hell. The Quran commentators said something similar to what we have said concerning that. (End quote)\nAl-Baghawi (may Allah have mercy on him) said: “The Day He will assemble you for the Day of Assembly” [At-Taghabun 64:9], meaning the Day of Resurrection, on which the people of heaven and earth will be brought together, is Yawm At-Taghabun (the Day of Deprivation). This word comes from the root Ghabn, which refers to missing out on one’s fortune. What is meant by Mabghun is the one who is deprived of his family and places in Paradise. Hence on that day the loss of every disbeliever will become apparent, because of his refusing to believe, as will the loss of every believer because of his falling short in doing righteous deeds. (End quote from Tafsir Al-Baghawi, 5/104)\nAl-Qurtubi (may Allah have mercy on him) said: The Day of Resurrection is called Yawm At-Taghabun, because on it the people of Paradise will have got the best deal, to the exclusion of the people of Hell. In other words, the people of Paradise will have gained Paradise, and the people of Hell will have gained Hell, by way of exchange (an unfair deal). This Ghabn took place because the latter gave up something good in exchange for something bad, and they gave up bliss for punishment. (End quote from Tafsir Al-Qurtubi, 18/136)\nAsh-Shinqiti (may Allah have mercy on him) said: The scholars explained what is meant by Ghabn in this context, by noting that each individual has a place in Paradise and a place in Hell. When the people of Hell enter Hell, their places in Paradise will remain, and when the people of Paradise enter Paradise, their places in Hell will remain. So the places in Hell that had been allocated to the people of Paradise will be given to the people of Hell, and the places in Paradise that had been allocated to the people of Hell will be inherited from them by the people of Paradise. So it will be a painful loss for the people of Hell, because the people of Paradise will have traded a place in Hell for a place in Paradise, and they will inherit the places of others who went to the Fire. (End quote from Adwa’ Al-Bayan, 8/201)\nShaykh Ibn `Uthaymin (may Allah have mercy on him) was asked: One of the Surahs of the Holy Quran is Surat At-Taghabun. What does Taghabun mean?\nHe (may Allah have mercy on him) replied: Taghabun means having a better deal by means of Ghabn. In this Surah, Allah, may He be Glorified and Exalted, states that Yawm At-Taghabun is in fact the Day of Resurrection. Allah, may He be exalted, says (interpretation of the meaning): “The Day He will assemble you for the Day of Assembly – that is the Day of Deprivation [Yawm At-Taghabun]” [At-Taghabun 64:9]. The real Taghabun (deprivation, disparity) is Taghabun in the hereafter, when one group will be in Paradise and the other group will be in Hell. As for Taghabun (deprivation, disparity) in this world, it is nothing in comparison to the Taghabun of the hereafter. Hence Allah, may He be Exalted, Says (interpretation of the meaning):\n{Look how We have favored [in provision] some of them over others. But the Hereafter is greater in degrees [of difference] and greater in distinction.} [Al-Isra’ 17:21] (End quote from Fatawa Nur `ala Ad-Darb, 5/2)\nFor more details, please see the following answers: 220511, 182318, 22203, 8398, 78329.\nAnd Allah knows best.']",https://islamqa.info/en/answers/299690/the-meaning-of-taghabun-insights-from-the-quran
147794,"What is the ruling on turning one’s back towards the qiblah for one who is waiting for the prayer? Because some people lean on the front wall of the mosque that is in the direction of the qiblah, so their backs are facing towards the qiblah.","['Praise be to Allah.It is disliked to turn one’s back towards the qiblah whilst waiting for the prayer if one has no excuse for doing that. What is prescribed is to sit facing towards the qiblah. This is the habit of people in their mosques in the past and in modern times.\nAt-Tabarani narrated in al-Awsat (2354) that Abu Hurayrah (may Allah be pleased with him) said: The Messenger of Allah (blessings and peace of Allah be upon him) said: “Everything has an ideal, and that the ideal when sitting is facing towards the qiblah.”\nClassed as hasan by al-Mundhiri in at-Targhib wa’t-Tarhib, 4663; and by al-Albani in Sahih at-Targhib, 3085.\nIbn Muflih (may Allah have mercy on him) said:\nIt is Sunnah to occupy oneself in the mosque with prayer, reading Qur’an, and reciting dhikr. One should sit facing towards the qiblah, and it is makruh to lean with one’s back towards the qiblah. Ahmad said: This is disliked. Al-Qadi clearly stated that it is disliked. Ibrahim said: They regarded it as disliked to lean [with one’s back] towards the qiblah before Fajr prayer. It was narrated by Abu Bakr an-Najjad.\nEnd quote from al-Adab ash-Shar`iyyah, 4/88.\nAnd Allah knows best.']",https://islamqa.info/en/answers/147794/ruling-on-turning-ones-back-towards-the-qiblah-for-one-who-is-waiting-for-the-prayer-in-the-mosque
