,question,answer,source
479866,"I work for a company that has contracts with some organisations, and it only accepts payment by electronic means, by passing the cell phone over a magnetic card. When the customer pays the bill, 2% or more of the total amount is added, and this is regarded as a tip for the workers. The customer may pay more as a tip, or he has the option of cancelling the tip and paying the value of the invoice only. But often the customers do not notice that they are paying an additional amount on the invoice. Is doing this haram or halal? What is the ruling on me doing that to them?","[""Praise be to Allah.Firstly:\nGiving tips to workers is permissible, subject to two conditions:\n1. That it is done with the consent of the customer.\n2. That it is done with the consent of the company for whom the workers are working. If it is not done with the knowledge and consent of the company, then it comes under the heading of gifts to workers, which is haram.\nPlease see the answer to question no. 143737 .\nSecondly:\nIt is not permissible to collect tips in a way that is not noticed by the customer, because this is consuming their wealth unlawfully. Allah, may He be exalted, says (interpretation of the meaning):\n{O you who have believed, do not consume one another's wealth unjustly but only [in lawful] business by mutual consent}\xa0[an-Nisa’ 4:29].\nThe Prophet (blessings and peace of Allah be upon him) said: “It is not permissible to take someone’s wealth except with his willing consent.” Narrated by Ahmad (20172); classed as sahih by al-Albani in Sahih Ahmad (7662).\nTips are to be regarded as a gift that is given willingly, and they are not valid unless they are given with the consent of the giver who is an adult of sound mind.\nIt says in Nayl al-Ma’arib bi Sharh Dalil at-Talib (2/28) in the chapter on gifts:\nThere are eight conditions [for giving of gifts]:\n1. The gift should be given by someone who is permitted to dispose of his wealth, meaning that he should be free [not a slave], accountable and of sound mind.\n2. It should be given voluntarily, of his own free will. A gift is not valid if it is given by one who is forced and is not joking. In that case, it is not valid…\nIn Majallat al-Ahkam al-‘Adliyyah (no.860) it says: It is stipulated, with regard to gifts, that the giver should be giving it willingly; a gift is not valid if the giver is forced to give it.\nIt says in Durar al-Hukkam Sharh Majallat al-Ahkam (2/399):\nIn order for a gift or charity to be valid, it is stipulated that the giver should give willingly. There are two scenarios in which the giver is not giving willingly:\nThe first scenario is when he is forced and compelled. Based on that, the gift is not valid if the giver is forced to give it and gives it unwillingly…\nThe second scenario is when the giver is prompted to say words indicative of giving in a language that he does not know. If the recipient prompts the giver to say “Wahabtu minka ma li ‘alayka min al-alf [What you owe me of one thousand is a gift for you],” and he says it, but the giver does not understand Arabic and there is no one to explain to him what this sentence means, this gift and waiving of the debt is not valid, if it is done in this way. That is because, even if there is no compulsion in this scenario, there is no consent to this giving. End quote.\nIf the customer does not notice the tip, it is haram for the worker to accept it and it is haram for the credit card company to make this addition subtle and not alert the customer to it, because that is helping in consuming wealth unlawfully, which is haram. Allah, may He be exalted, says (interpretation of the meaning):\n{And cooperate in righteousness and piety, but do not cooperate in sin and transgression. And fear Allah; indeed, Allah is severe in penalty}\xa0[al-Ma’idah 5:2].\nIf the company makes the paying of tips unclear so that the customer does not notice it, then they must be advised to make the matter very clear to the customer. If they insist on hiding it, then you should not carry on working for them. Whoever gives up something for the sake of Allah, Allah will compensate him with something better than it.\nAnd Allah knows best.""]",https://islamqa.info/en/answers/479866/he-adds-the-tip-to-the-customers-bill-when-he-pays-electronically-without-the-customers-knowledge-and-without-him-realising-that
205100,I am an employee in a government-run company. My question is whether the health insurance offered by my company is permissible. It can be summed up in the following two points:,"['Praise be to Allah.Difference between cooperative insurance and commercial insurance\xa0\nThe most important difference between cooperative insurance and commercial insurance is that the money deducted for cooperative insurance is not owned by the committee that is administering the fund; rather it remains a donation that is to be spent on whoever meets the conditions.\nIn contrast, the administrators of commercial health insurance funds have ownership of the subscriptions and deductibles paid by the subscribers, and that is included in their personal accounts, in return for the administration committee being committed to treat anyone who meets the conditions. There is a big difference between the two types.\xa0\n\nThe first type is cooperative and offers mutual support, and there is a Hadith that supports it in principle. It was narrated that Abu Musa (may Allah be pleased with him) said: The Prophet (blessings and peace of Allah be upon him) said: “If the Ash`aris run short of provisions during a campaign, or they run short of food for their families in Madinah, they gather whatever they have in a single cloth and share it out equally amongst themselves. They belong to me and I belong to them.” (Narrated by Al-Bukhari, 2486)\xa0\n\nAl-Bukhari included it in a chapter entitled: “Chapter on sharing food and other resources, and how to divide that which may be weighed or measured handful by handful (without weighing it or measuring it), because the Muslims did not see anything wrong with sharing out provisions when traveling so that one could come and have some, and another could come and have some…”\xa0\n\nAs for the second type (commercial insurance ), it is a kind of gambling; all contemporary Fiqh councils are agreed that it is forbidden.\xa0\n\nDifferences between lawful and forbidden cooperative health insurance\xa0\nThere are other essential differences between cooperative health insurance to which it is permissible to subscribe, and that forbidden type of insurance which is based on gambling. It is essential to investigate these differences before issuing a fatwa ruling that any specific case is lawful or prohibited.\xa0\nIt says in Al-Ma`ayir Ash-Shar‘iyyah (p. 372-373):\xa0\nThe reason why cooperative insurance is permissible and commercial insurance is forbidden is the following essential differences:\xa0\n\nTraditional (commercial) insurance is a contract offering something in return for financial compensation; it is aimed at making a profit from the insurance itself, therefore it is subject to the same rulings as other financial transactions, whereby it may be affected by ambiguity. The ruling on traditional insurance is that it is forbidden according to Shari`ah. As for cooperative insurance, it is a commitment to donate and is not affected by ambiguity.\nThe company that manages Islamic insurance [or an insurance fund in some cases, such as that mentioned in this question] is acting as an agent when drawing up the insurance contract. In contrast, the company is a main party in the case of commercial insurance and draws up contracts in its own name.\nIn the case of commercial insurance , the company has ownership of the payments made in return for the commitment to pay out money in the case of illness. In the case of the Islamic insurance company, it does not have ownership of these payments, because these payments become the property of the fund .\nWhatever is left of the payments and their returns – after payment of expenses and compensation – remains in the ownership of the policy holders, and this is the surplus which is to be distributed to them. But this is not possible in the case of commercial insurance, because the payments become the property of the company by virtue of the contract and receipt of the payments. In fact that money is regarded as income and profit in the case of commercial insurance.\nReturns on the investment of monthly subscriptions, after deducting a percentage of the profit for the company (which is investing the fund), go back to the policyholders in the case of Islamic insurance, and they go back to the company itself in the case of commercial insurance.\nIslamic insurance is aimed at creating cooperation between different members of society; it is not aimed at making a profit by selling the insurance. In contrast, commercial insurance is aimed at making a profit from the insurance itself.\nIn the case of Islamic insurance, the company’s profits result from investing its money and its share of the profit in Mudarabah investments, because it is managing the funds and investments, and the fund itself is the owner of the wealth.\nThe one who subscribes and the one who is giving the insurance is the same in the case of Islamic insurance, even though they may be different in practical terms. In the case of commercial insurance, they are two completely different entities.\nIn the case of Islamic insurance, the company is bound by the rulings of Shari`ah and the Fatwas of its Shari`ah committee. In the case of commercial insurance, it is not bound by the rulings of Shari`ah. End quote.\n\nWe know that many of these differences are not relevant when speaking about the fund mentioned in the question, but we have quoted them here so that the reader may understand the real and important differences between cooperative insurance which is permissible, and commercial insurance which is forbidden, and thus will be able to weigh up and judge other types of governmental health insurance funds.\xa0\nHow to issue a Fatwa regarding funds of insurance\xa0\nIn order to issue a precise Fatwa concerning your fund and to try to help you to follow the Shar`i guidelines on cooperative insurance, it is essential that you send us the official documents which regulate the work of the fund, and the contracts that subscribers have to sign, so that we can study them and determine the ruling on them. Although we think it most likely that the way your fund is operated is sound, in sha Allah, we cannot be certain of the ruling before examining the official rules and regulations governing the fund, and the application forms for joining it.\xa0\nThe book Al-Ma`ayir Ash-Shar`iyyah stipulates a number of basic matters which must be stated in the articles of association of cooperative funds, as it says (p. 364):\xa0\n“Islamic insurance is an agreement among people who are exposed to a particular danger to deal with any harm resulting from this danger, by paying subscriptions in the form of a commitment to donate; from that a fund is formed that is a separate, financially independent, virtual entity, from which compensation is paid for harm that may befall one of the subscribers because of some danger against which he was insured, in accordance with the bylaws and contracts. The administration of this fund is handled by a committee chosen from among the policyholders or by a limited liability company in return for a fee paid to administer the insurance and invest the money in the fund.\xa0\nAs for traditional insurance, it is a financial transaction that is aimed at making profits from the insurance itself, subject to the rulings on financial transactions that may be affected by ambiguity; the ruling on traditional insurance is that it is forbidden according to Shari`ah (because of the ambiguity it involves).\xa0\nPrinciples of Islamic insurance\xa0\nIslamic insurance is based upon the following Shar`i guidelines and principles, which must be stated clearly in the company’s articles of association:\xa0\n\nThe commitment to donate, whereby the policyholder donates his monthly subscriptions and the returns on them to the fund, in order to pay compensation. He may also commit himself to pay his share towards covering any deficit, in accordance with the bylaws.\nThe company that is running the insurance fund should have two separate accounts: one which has to do with the company itself and its rights and commitments, and another which has to do with the fund and the rights and commitments of the policyholders.\nThe company is acting as an agent when administering the fund and when investing what is owned by the fund.\nThe insurance account has to do with whatever is owned by the fund and the returns on its investments, as well as other commitments.\nThe bylaws may include a clause dealing with disposal of any surplus according to what serves the interests of the policyholders, provided that the company that is administering the fund does not get any of this surplus.\nIn the event of liquidation, all the money in the fund and any surplus accumulated is to be spent on charitable causes.\nIt is preferred that the policyholders should administer the insurance fund.\nThe company is committed to abide by all rulings and principles of Islamic Shari`ah in all its activities and investments, and in particular is not to insure anything that is forbidden.\nA Shari`ah watchdog committee should be appointed whose fatwas will be binding upon the company.”\xa0\n\nAll of these matters should be paid attention to in the bylaws that regulate the activities of the insurance fund, especially those that invest these subscriptions of the people insured for the benefit of the fund. It is essential to ensure that these principles are present in the bylaws and articles of association governing the insurance.\xa0\nAnd Allah knows best.']",https://islamqa.info/en/answers/205100/difference-between-cooperative-insurance-and-commercial-insurance
21614,Are there any Du`a’s that we can say at times of calamity and tribulation such as war and the disbelievers' attacks against Muslim countries?,"['Praise be to Allah.The Prophet’s prayers at times of tribulation\nThe Prophet (peace and blessings of Allah be upon him) used to seek refuge with Allah a great deal from trials and tribulations , as it says in the Hadith of Zayd ibn Thabit (may Allah be pleased with him) that the Prophet (peace and blessings of Allah be upon him) said, “Seek refuge with Allah from trials and tribulations, both visible and hidden.” (Narrated by Muslim, 2867)\xa0\nIt was narrated from Ibn `Abbas (may Allah be pleased with him) that the Messenger of Allah (peace and blessings of Allah be upon him) said: “My Lord came to me tonight in the most beautiful form…” and in this Hadith he said that Allah said, “O Muhammad, when you pray, then say: `Allahumma inni as’aluka fi`l Al-khayrat wa tark Al-munkarat, wa hubb Al-masakin, wa an taghfira li wa tarhamani wa tatuba `alayya. Wa in aradta bi `ibadika fitnatan, faqbidni ilayka ghayra maftun (O Allah, I ask You (to enable me) to do good deeds and avoid evil deeds, and to love the poor, and (I ask You) to forgive me, have mercy on me and accept my repentance. If You will that some trial should befall Your slaves, then take me to You [i.e., cause me to die] without having subjected to that trial).” (Narrated by At-Tirmidhi, 3233; Al-Albani said of this Hadith is authentic in Sahih At-Targhib wat-Tarhib, 408)\xa0\nThe Prophet (peace and blessings of Allah be upon him) used to seek refuge from trials and tribulations because when they come they do not befall the wrongdoers only, rather they befall everyone.\xa0\nDu`a at times of tribulation and hardship\nIt is a good idea to acquaint ourselves with the Hadiths that mention Dhikrs which have to do with trials and tribulations and disasters, so that we may call upon Allah with these words and spread this knowledge and memorize whatever we can of them… and understand their meanings so that we can worship Allah by means of them, because they are the greatest words that can be spoken in these circumstances.\xa0\n·\xa0\xa0\xa0\xa0\xa0\xa0\xa0\xa0 Abu Burdah ibn `Abdullah narrated from his father that when the Prophet (peace and blessings of Allah be upon him) was afraid of some people he would say, “Allahumma inna naj`aluka fi nuhurihim wa na`udhu bika min shururihim (O Allah, we place You before them and we seek refuge in You from their evil).”\xa0(Narrated by Abu Dawud, 1537; classed as authentic by Al-Albani in Sahih Abu Dawud, 1360)\n·\xa0\xa0\xa0\xa0\xa0\xa0\xa0\xa0 It was narrated from Ibn `Abbas (may Allah be pleased with him) that the Messenger of Allah (peace and blessings of Allah be upon him) used to say at times of distress : “La ilaha ill-Allah Al-`Athim Al-Halim, la ilaha ill-Allah Rabb Al-`Arsh Al-`Athim, la ilaha ill-Allah Rabb us-samawati wa Rabb ul-ard wa Rabb ul-`Arsh il-karim (There is none worthy of worship but Allah, the All-Powerful, the Forbearing; there is none worthy of worship but Allah, Lord of the mighty Throne; there is none worthy of worship but Allah, Lord of heaven, Lord of earth, and Lord of the noble Throne).” (Narrated by Al-Bukhari, 6345; Muslim, 2730)\n·\xa0\xa0\xa0\xa0\xa0\xa0\xa0\xa0 The Prophet (peace and blessings of Allah be upon him) said: “The words of relief are: La ilaha ill-Allah Al-`Athim Al-Halim, la ilaha ill-Allah Rabb Al-`Arsh Al-`Athzim, la ilaha ill-Allah Rabb us-samawati wa Rabb ul-ard wa Rabb ul-`Arsh il-karim (There is none worthy of worship but t Allah, the All-Powerful, the Forbearing; there is none worthy of worship but Allah, Lord of the mighty Throne; there is none worthy of worship but Allah, Lord of heaven, Lord of earth, and Lord of the noble Throne).” (Sahih Al-Jami` As-Saghir wa Ziyadatuhu, 4571)\xa0\n·\xa0\xa0\xa0\xa0\xa0\xa0\xa0\xa0 When the Prophet (peace and blessings of Allah be upon him) went on a military campaign he would say, `Allahumma anta `adudi wa anta nasiri wa bika uqatil (O Allah, You are my help and You are my support and by Your help I fight).” (Narrated by At-Tirmidhi, 3584; classed as authentic by Al-Albani in Sahih At-Tirmidhi, 2836.)\n·\xa0\xa0\xa0\xa0\xa0\xa0\xa0\xa0 The Prophet (peace and blessings of Allah be upon him) said: “Shall I not tell you of something that, if any worldly calamity or disaster befalls any man among you and he says these words, he will be relieved of it. (It is) the Du’a’ of Dhu’n-Nun: “La ilaha illa anta subhanaka inni kuntu min Ath-thalimin (none has the right to be worshipped but You (O Allah), Glorified (and Exalted) be You [above all that (evil) they associate with You]! Truly, I have been of the wrongdoers).” According to another report: “No Muslim man says this Du’a’ concerning anything but Allah will answer his prayer.” (Sahih Al-Jami’ As-Saghir wa Ziyadatuhu, 2065)\n·\xa0\xa0\xa0\xa0\xa0\xa0\xa0\xa0 The Messenger of Allah (peace and blessings of Allah be upon him) used to teach his Companions to say these words when they felt afraid: “A’udhu bi kalimat-illah il-tammati min ghadabihi wa min sharri `ibadihi wa min hamazat Ash-shayatini wa an yahdurun (I seek refuge in the perfect words of Allah from His wrath and from the evil of His slaves and from the evil promptings of the devils and from their presence).” (Narrated by Abu Dawud, 3893; classed as sound by Al-Albani in Sahih Abu Dawud, 3294)\n·\xa0\xa0\xa0\xa0\xa0\xa0\xa0\xa0 The Messenger of Allah (peace and blessings of Allah be upon him) said: “The Du’a’ of the person who is in distress is: `Allahumma rahmataka arju fa la takilni ila nafsi tarfat `ayn wa aslih li sha’ni kullahu la ilaha illa anta (O Allah, for Your mercy I hope, so do not leave me in charge of my affairs even for the blink of an eye; rectify all my affairs. There is none worthy of worship but You)’” (Narrated by Abu Dawud, 5090; classed as sound by Al-Albani in Sahih Abu Dawud, 4246)\xa0\n·\xa0\xa0\xa0\xa0\xa0\xa0\xa0\xa0 If some matter was troubling him, he would say, Ya Hayyu ya Qayyum bi rahmatika astaghith (O Ever-Living, O Sustainer, by Your mercy I seek Your help).” According to another report: “If some matter worried him or distressed him.” Sahih Al-Jami` As-Saghir, 4791)\xa0\nThe Messenger of Allah (peace and blessings of Allah be upon him) said: to Asma’ bint `Umays (may Allah be pleased with her), “Shall I not teach you some words which you can say at times of distress and hardship ? `Allahu Allahu rabbi la ushriku bihi shay’an (Allah is my Lord, I do not associate anything with Him).’” (Narrated by Abu Dawud, 1525; classed as authentic by Al-Albani in Sahih Abu Dawud, 1349)\xa0\nAccording to a version narrated in Al-Sahih Al-Jami’, “Whoever is afflicted by worry, distress, sickness or hardship, and says, Allahu Allahu rabbi la sharika lah (Allah is my Lord, He has no partner or associate), will be relieved of that.”\xa0\nAnd there are other Hadiths which will have a positive effect in times of tribulation and fear, bringing peace of mind and physical safety, and drawing one closer to Allah… We should be content with that which has been narrated in authentic reports from the Prophet (peace and blessings of Allah be upon him), for that is sufficient and we have no need to report that are not sound. This is better. And Allah knows best.\xa0\nFor more details, please see the following answers: 12715 , 9577 , 21677 , 22438 , 20176 , 84030 , and 174515 .\nAnd Allah knows best.']",https://islamqa.info/en/answers/21614/dhikr-at-times-of-tribulation-and-hardship
